{
  "bank_name": "v10_vehicle",
  "channels": 1,
  "files": [
    {
      "dc_offset": -8e-06,
      "duration_s": 0.650635,
      "file": "backfire_3.wav",
      "loop": false,
      "loop_end_s": null,
      "loop_start_s": null,
      "loudness_dbfs": -18.16,
      "peak": 0.89,
      "provenance": "derived from original user-supplied replacement samples",
      "role": "engine_backfire",
      "sha256": "f41b950f6f102dfbe960d1ba9cdb6a52bfbf1bb029faaba0332ddfcf398df130",
      "synthesis": {
        "category": "engine",
        "processing": {
          "fade_in_frames": 88,
          "fade_out_frames": 529,
          "remove_dc": true,
          "source_rate": 44100,
          "target_peak": 0.89,
          "target_rate": 44100
        },
        "promotion_recipe": "f1_2030_sfx_backfire_overlay_v1",
        "source_file": "source-assets/audio/replacements/f1_2030/500_backfire3.wav",
        "source_rate": 44100,
        "source_sha256": "e107717d2fe4f4fccd5d10d910b7cff71cd36d11403ef2a1277d36418986d044"
      }
    },
    {
      "dc_offset": -1e-06,
      "duration_s": 0.594966,
      "file": "backfire_4.wav",
      "loop": false,
      "loop_end_s": null,
      "loop_start_s": null,
      "loudness_dbfs": -18.26,
      "peak": 0.89,
      "provenance": "derived from original user-supplied replacement samples",
      "role": "engine_backfire",
      "sha256": "fef814aed76fa5d0ed65be83a05929454778bb7597c1a3cc5479cfc9ae74ad8c",
      "synthesis": {
        "category": "engine",
        "processing": {
          "fade_in_frames": 88,
          "fade_out_frames": 529,
          "remove_dc": true,
          "source_rate": 44100,
          "target_peak": 0.89,
          "target_rate": 44100
        },
        "promotion_recipe": "f1_2030_sfx_backfire_overlay_v1",
        "source_file": "source-assets/audio/replacements/f1_2030/500_backfire4.wav",
        "source_rate": 44100,
        "source_sha256": "e903a055cf8b5ca6a79b44862681f12bca5a11e95878f091095d613e7b63171e"
      }
    },
    {
      "dc_offset": -1.7e-05,
      "duration_s": 0.362132,
      "file": "backfire_5.wav",
      "loop": false,
      "loop_end_s": null,
      "loop_start_s": null,
      "loudness_dbfs": -17.12,
      "peak": 0.89,
      "provenance": "derived from original user-supplied replacement samples",
      "role": "engine_backfire",
      "sha256": "d36d1b4b06d1b75b21ba00af07d44ab9b2b9bf89a01d7da9166210c384372267",
      "synthesis": {
        "category": "engine",
        "processing": {
          "fade_in_frames": 88,
          "fade_out_frames": 529,
          "remove_dc": true,
          "source_rate": 44100,
          "target_peak": 0.89,
          "target_rate": 44100
        },
        "promotion_recipe": "f1_2030_sfx_backfire_overlay_v1",
        "source_file": "source-assets/audio/replacements/f1_2030/500_backfire5.wav",
        "source_rate": 44100,
        "source_sha256": "a471a47bc8094a38e50894713b47b7847d81e1c518830b804e25dc87a69ceec1"
      }
    },
    {
      "dc_offset": -1.7e-05,
      "duration_s": 0.396735,
      "file": "backfire_6.wav",
      "loop": false,
      "loop_end_s": null,
      "loop_start_s": null,
      "loudness_dbfs": -17.81,
      "peak": 0.89,
      "provenance": "derived from original user-supplied replacement samples",
      "role": "engine_backfire",
      "sha256": "866f03f79303e1f78c6b97d117a546a2eb7714978e652acf4900875cad365e27",
      "synthesis": {
        "category": "engine",
        "processing": {
          "fade_in_frames": 88,
          "fade_out_frames": 529,
          "remove_dc": true,
          "source_rate": 44100,
          "target_peak": 0.89,
          "target_rate": 44100
        },
        "promotion_recipe": "f1_2030_sfx_backfire_overlay_v1",
        "source_file": "source-assets/audio/replacements/f1_2030/500_backfire6.wav",
        "source_rate": 44100,
        "source_sha256": "6179b1460c81f58ce6ed69dd48498e0efcb3ec66eb18054cf1d97ac444426797"
      }
    },
    {
      "dc_offset": -9e-06,
      "duration_s": 0.776916,
      "file": "backfire_7.wav",
      "loop": false,
      "loop_end_s": null,
      "loop_start_s": null,
      "loudness_dbfs": -14.21,
      "peak": 0.89,
      "provenance": "derived from original user-supplied replacement samples",
      "role": "engine_backfire",
      "sha256": "2040468949094b6514b31939323848e601c285f95a2b7c8f568604da3b5f8018",
      "synthesis": {
        "category": "engine",
        "processing": {
          "fade_in_frames": 88,
          "fade_out_frames": 529,
          "remove_dc": true,
          "source_rate": 44100,
          "target_peak": 0.89,
          "target_rate": 44100
        },
        "promotion_recipe": "f1_2030_sfx_backfire_overlay_v1",
        "source_file": "source-assets/audio/replacements/f1_2030/500_backfire7.wav",
        "source_rate": 44100,
        "source_sha256": "ed324b6935950738a6cb4eb0ba99eab74b58bd24fe8b6a9dc75973b47269c42c"
      }
    },
    {
      "dc_offset": -0.0,
      "duration_s": 3.285624,
      "file": "engine_start_backfire.wav",
      "loop": false,
      "loop_end_s": null,
      "loop_start_s": null,
      "loudness_dbfs": -10.31,
      "peak": 0.89,
      "provenance": "derived from original samples (source-assets/audio/legacy-f1-1998)",
      "role": "engine_start_backfire",
      "sha256": "8174637993898bf59c07dca62f41c1ac607b91634c43e890033006de30ebf022",
      "synthesis": {
        "category": "start",
        "source_file": "98_start_backfire.wav",
        "source_rate": 22050,
        "source_sha256": "10501a48937a1df99353bace8d17e789be84bb7b0be66d93d282da5a226be119"
      }
    },
    {
      "dc_offset": -0.0,
      "duration_s": 2.442585,
      "file": "engine_starter.wav",
      "loop": false,
      "loop_end_s": null,
      "loop_start_s": null,
      "loudness_dbfs": -14.56,
      "peak": 0.89,
      "provenance": "derived from original samples (source-assets/audio/legacy-f1-1998)",
      "role": "engine_starter",
      "sha256": "c27833ef25079e1503a281a1be71bfc433c1a96c3fd476a5539fd5a2357f32ba",
      "synthesis": {
        "category": "start",
        "source_file": "98_starter.wav",
        "source_rate": 22050,
        "source_sha256": "9cd06da343af654960fa27f6d294b7f5970d1366f200b5a88e15f5aa06d94821"
      }
    },
    {
      "dc_offset": -1.5e-05,
      "duration_s": 2.44322,
      "file": "impact_barrier.wav",
      "loop": false,
      "loop_end_s": null,
      "loop_start_s": null,
      "loudness_dbfs": -9.72,
      "peak": 0.919983,
      "provenance": "derived from original samples (source-assets/audio/legacy-f1-1998); remastered with modular synthesis (impact stages)",
      "role": "impact_barrier",
      "sha256": "846e3156f14cfd869d780ebb2792199bb3289144edb30d621a0317e45292b4da",
      "synthesis": {
        "category": "impact",
        "remaster": {
          "kind": "barrier",
          "recipe": "impact_remaster_v1"
        },
        "source_file": "GP_barrier.wav",
        "source_rate": 44100,
        "source_sha256": "c4c3210cdc1119f4ef38055e15e843a085111806e45b1bdea28c8a8d87784b68"
      }
    },
    {
      "dc_offset": -1.5e-05,
      "duration_s": 0.351519,
      "file": "impact_cone.wav",
      "loop": false,
      "loop_end_s": null,
      "loop_start_s": null,
      "loudness_dbfs": -15.32,
      "peak": 0.919983,
      "provenance": "derived from original samples (source-assets/audio/legacy-f1-1998); remastered with modular synthesis (impact stages)",
      "role": "impact_cone",
      "sha256": "0e9cd6cb035dba091be061c216feda098669aa8a67d27e64e640e77c45da478a",
      "synthesis": {
        "category": "impact",
        "remaster": {
          "kind": "cone",
          "recipe": "impact_remaster_v1"
        },
        "source_file": "GP_conehit.wav",
        "source_rate": 22050,
        "source_sha256": "664225b6d640c799d2752cf37a45d3258fdcc478ace3f41d011c1af5e7552ee4"
      }
    },
    {
      "dc_offset": -1.6e-05,
      "duration_s": 1.6,
      "file": "impact_fire.wav",
      "loop": false,
      "loop_end_s": null,
      "loop_start_s": null,
      "loudness_dbfs": -10.84,
      "peak": 0.919983,
      "provenance": "derived from original samples (source-assets/audio/legacy-f1-1998); remastered with modular synthesis (impact stages)",
      "role": "impact_fire",
      "sha256": "3cf65c7771ab100d487a4e614ef218093130d66fbf61747d9ee3e7f16e226d36",
      "synthesis": {
        "category": "impact",
        "remaster": {
          "kind": "fire",
          "recipe": "impact_remaster_v1"
        },
        "source_file": "GP_fire.WAV",
        "source_rate": 22050,
        "source_sha256": "1d9e6ddba4cd06561c96e97bcf578fa0f0c2a9656cc4e86b755256a0c4ae9c34"
      }
    },
    {
      "dc_offset": -0.0,
      "duration_s": 0.802812,
      "file": "impact_hit_1.wav",
      "loop": false,
      "loop_end_s": null,
      "loop_start_s": null,
      "loudness_dbfs": -13.6,
      "peak": 0.89,
      "provenance": "derived from original user-supplied replacement samples",
      "role": "impact_hit",
      "sha256": "4f0fa91a560a835fbe2c10822bea10a74f1d4395505f6ea74959cffa2030f6b9",
      "synthesis": {
        "category": "impact",
        "processing": {
          "remove_dc": true,
          "source_rate": 44100,
          "target_peak": 0.89,
          "target_rate": 44100
        },
        "promotion_recipe": "f1_2026_2008_replacement_overlay_v1",
        "source_file": "source-assets/audio/replacements/f1_2026_2008/impact_hit_1.wav",
        "source_rate": 44100,
        "source_sha256": "e59cd6af9b5c0896f3b53a3ed0e5d6892914fb74a54b0123b38c95cdcde3bfc6"
      }
    },
    {
      "dc_offset": 0.0,
      "duration_s": 3.791315,
      "file": "impact_hit_2.wav",
      "loop": false,
      "loop_end_s": null,
      "loop_start_s": null,
      "loudness_dbfs": -15.86,
      "peak": 0.89,
      "provenance": "derived from original user-supplied replacement samples",
      "role": "impact_hit",